{
  "version": 1,
  "revision": 2,
  "dispatch_id": "dp_5n2q8r0t3v6w9x1y",
  "run_id": "0192f0c1-7d4e-7a2b-8c3d-4e5f6a7b8c9d",
  "pool_id": "np_f1xt0re000000000",
  "lease_until": "2026-10-15T12:05:00Z",
  "step": "prebuild",
  "access": "read",
  "target": {
    "system": "code.example.com",
    "path": "acme/shop"
  }
}
